{
  "$schema": "https://json-schema.org/draft/2020-12/schema",
  "$id": "https://kura.example/schemas/motion-tokens.schema.json",
  "title": "Kura Interaction Motion Tokens",
  "type": "object",
  "required": [
    "meta",
    "primitive",
    "semantic",
    "component",
    "reducedMotion",
    "policies"
  ],
  "properties": {
    "$schema": {
      "type": "string",
      "minLength": 1
    },
    "meta": {
      "type": "object",
      "required": [
        "name",
        "version",
        "principle",
        "units"
      ],
      "properties": {
        "name": {
          "type": "string",
          "minLength": 1
        },
        "version": {
          "type": "string",
          "pattern": "^[0-9]+\\.[0-9]+\\.[0-9]+$"
        },
        "principle": {
          "type": "string",
          "minLength": 1
        },
        "units": {
          "type": "object",
          "required": [
            "duration",
            "distance"
          ],
          "properties": {
            "duration": {
              "const": "ms"
            },
            "distance": {
              "const": "px"
            }
          },
          "additionalProperties": false
        }
      },
      "additionalProperties": false
    },
    "primitive": {
      "type": "object",
      "required": [
        "duration",
        "delay",
        "easing",
        "distance",
        "opacity",
        "scale"
      ],
      "properties": {
        "duration": {
          "$ref": "#/$defs/nonNegativeNumberMap"
        },
        "delay": {
          "$ref": "#/$defs/nonNegativeNumberMap"
        },
        "easing": {
          "$ref": "#/$defs/stringMap"
        },
        "distance": {
          "$ref": "#/$defs/nonNegativeNumberMap"
        },
        "opacity": {
          "$ref": "#/$defs/unitIntervalMap"
        },
        "scale": {
          "$ref": "#/$defs/nonNegativeNumberMap"
        }
      },
      "additionalProperties": false
    },
    "semantic": {
      "type": "object",
      "minProperties": 1,
      "additionalProperties": {
        "$ref": "#/$defs/tokenRecord"
      }
    },
    "component": {
      "type": "object",
      "minProperties": 1,
      "additionalProperties": {
        "$ref": "#/$defs/tokenRecord"
      }
    },
    "reducedMotion": {
      "type": "object",
      "required": [
        "removeLargeSpatialMotion",
        "removeParallax",
        "removeDecorativeLoops",
        "preserveStateChange",
        "preferredDuration",
        "allowedProperties"
      ],
      "properties": {
        "removeLargeSpatialMotion": {
          "type": "boolean"
        },
        "removeParallax": {
          "type": "boolean"
        },
        "removeDecorativeLoops": {
          "type": "boolean"
        },
        "preserveStateChange": {
          "type": "boolean"
        },
        "preferredDuration": {
          "$ref": "#/$defs/tokenOrValue"
        },
        "allowedProperties": {
          "type": "array",
          "minItems": 1,
          "uniqueItems": true,
          "items": {
            "type": "string"
          }
        }
      },
      "additionalProperties": false
    },
    "policies": {
      "type": "object",
      "required": [
        "blockInputDuringAnimation",
        "animateFromCurrentRenderedState",
        "allowUserInterruption",
        "maximumAttentionRepeats",
        "hoverIsEnhancementOnly",
        "criticalMeaningRequiresNonMotionCue"
      ],
      "properties": {
        "blockInputDuringAnimation": {
          "const": false
        },
        "animateFromCurrentRenderedState": {
          "const": true
        },
        "allowUserInterruption": {
          "const": true
        },
        "maximumAttentionRepeats": {
          "type": "integer",
          "minimum": 0,
          "maximum": 1
        },
        "hoverIsEnhancementOnly": {
          "const": true
        },
        "criticalMeaningRequiresNonMotionCue": {
          "const": true
        }
      },
      "additionalProperties": false
    }
  },
  "$defs": {
    "nonNegativeNumberMap": {
      "type": "object",
      "minProperties": 1,
      "additionalProperties": {
        "type": "number",
        "minimum": 0
      }
    },
    "unitIntervalMap": {
      "type": "object",
      "minProperties": 1,
      "additionalProperties": {
        "type": "number",
        "minimum": 0,
        "maximum": 1
      }
    },
    "stringMap": {
      "type": "object",
      "minProperties": 1,
      "additionalProperties": {
        "type": "string",
        "minLength": 1
      }
    },
    "tokenOrValue": {
      "oneOf": [
        {
          "type": "number",
          "minimum": 0
        },
        {
          "type": "string",
          "minLength": 1
        },
        {
          "type": "boolean"
        }
      ]
    },
    "tokenRecord": {
      "type": "object",
      "minProperties": 1,
      "additionalProperties": {
        "oneOf": [
          {
            "$ref": "#/$defs/tokenOrValue"
          },
          {
            "type": "array",
            "items": {
              "$ref": "#/$defs/tokenOrValue"
            }
          }
        ]
      }
    }
  },
  "additionalProperties": false
}
